organization_id,title,content,url
amberkinetics,"The Amber Kinetics Inc. Mission | Amber Kinetics, Inc","The Amber Kinetics Inc. Mission | Amber Kinetics, Inc                                                  Skip to the content         Search              Menu       Technology Company  Team Careers   Installations News Contact        Search             			Search for:		       					Close search				              Close Menu     Technology CompanyShow sub menu  Team Careers   Installations News Contact             The Amber Kinetics Inc. Mission           Amber Kinetics’ mission is to provide an emission-free, economical and safe energy storage solution – creating reliable and sustainable energy infrastructure around the world. Sustainability is in our DNA as a company. While we focus on delivering this mission globally, we also recognize the importance of evaluating our own product, supply chain and operations for opportunities to reduce our carbon footprint today and in the future. Our flywheels consist of a simple yet powerful steel design and use readily and widely available materials. We do not rely on rare earth materials, resulting in a less carbon intense manufacturing process.           Our Global Operations   Amber Kinetics' head office and centre of expertise is located in Union City, California, in the San Francisco Bay Area. From our main office we design our next generation models, performing mechanical, electronic and software engineering and testing our new designs. Our workshops assemble and test flywheels, flywheel management systems, and all balance of systems components. Our 2 state of the art manufacturing facilities are located in Philippine Special Economic Zones benefiting from duty holidays and access to cutting edge eastern markets. Our manufacturing plants are capable of producing 4000 units a year, operating a LEAN best practice and regular Kaizen activities.                             Contact Us                              Over 14 years of field and technical expertise with worldwide deployments achieving over one million hours of operational run time             2009 Amber Kinetics founded by Dr. Seth Sanders and Ed Chiao           2010 Amber Kinetics awarded US $3.6m grant from US Dept. of Energy         2012 Completion of 5kWh long-duration Flywheel Energy Storage System (FESS) prototype         2013 Completion of series A funding round           2014 25kWh long-duration FESS operational in Alameda, CA test facility, funded by US $1.8m grant from California Energy Commission         2015 Amber Kinetics signs agreement with Elemental Excelerator, based in Honolulu Hawaii           2016 Amber Kinetics signs supply agreements with Hawaiian Electric         2016 Completion of series B funding and Amber Kinetics awarded second grant from California Energy Commission for US $2.0m           2016 Two FESS units deployed with customers in Phillipines           2017 First commercial supply agreements with multiple global customers           2017 Amber Kinetics agrees two year cooperation agreement with Enel         2018 Mfg factory opens in Phillipines         2018 FESS projects go operational in USA (Hawaii and Massachusetts) and China (Tibet)           2019 FESS project operational with Taiwan Power         2020 Amber Kinetics signs first commercial supply agreement with customer in Australia           2021 Three FESS projects operational in Australia           2022 FESS project operational in Japan           2023 MOU with Philippine-Japan consortium to develop integrated solutions         2023 FESS fleet reaches 1 million hours of operations globally           2023 First mWh scale contract signed with Philippine based PAVI                            Do you think you have what it takes to join the Amber Kinetics Team?               We are always on the look out for the best talent to help in all areas of our operation. Whether you're a mechanical engineer, know your way around a circuit board or a dab hand a getting those around you organised we'd love to hear from those who share our passions for sustainability and word class product quality.                             View our vacancies here.                            Find out more.  Get in touch!               •    •        32920 Alvarado Niles Road #250, Union City, California 94587 +1.510.474.1000                                ©                             2024				    		Amber Kinetics, Inc. All rights reserved.                          Legal & Cookie Policy | Data Room | Target Market Application",https://amberkinetics.com/company/
amberkinetics,"Amber Kinetics Inc. Leadership | Amber Kinetics, Inc","Amber Kinetics Inc. Leadership | Amber Kinetics, Inc                                                  Skip to the content         Search              Menu       Technology Company  Team Careers   Installations News Contact        Search             			Search for:		       					Close search				              Close Menu     Technology CompanyShow sub menu  Team Careers   Installations News Contact             Amber Kinetics Inc. Leadership             Edgar Chua Chief Executive Officer
 	      Former Country Chairman of Shell companies in the Philippines (2003-2016) and various senior positions across Shell Group Companies for over 38 years. Independent Director for First Gen, Integrated Micro-Electronics (IMI), Metrobank, PHINMA, Philcement and JG Summit Petrochemicals, Chairman of the Makati Business Club, De La Salle University Board of Trustees, DLSU Science Foundation and the Philippine Eagle Foundation. 2014 Outstanding Chemical Engineer Award, Philippine Institute of Chemical Engineers, 2013 Management Association of the Philippines “Management Man of the Year,” and 2005 CEO EXCEL for Excellence in Communication in Organizations. B.S. in Chemical Engineering, De La Salle University; Senior leadership course at INSEAD.      Luis Virata Chairman
 	      Chairman Emeritus of Exchange Equity Partners Group Corporation, with 30+ years leading investment banking ventures. Raised more than $8.3Bn in equity for Philippine corporates since 1991, advised more than $10.7Bn worth of M&A, JV, and Financial Advisory transactions. Major shareholder and Director of Nickel Asia Corporation, one of the largest nickel ore exporters in the world. Member of the Huntsman Foundation of the Wharton School, Honorary Doctorate in Humanities from De La Salle University Dasmarinas. MBA from the Wharton School of University of Pennsylvania, Bachelors and Master of Arts in Economics from Trinity College, Cambridge University.      Fabrice Glorieux Chief Operating Officer
 	      30+ years of international executive experience (general and operations management, incl. Kaizen and continuous improvement) in the electrical/energy sectors covering Europe, Asia, and North America. Previously held Regional Managing Director and VP positions at ABB and Schneider Electric, and acted as independent advisor to start-ups in EV charging solutions, energy efficiency, and smart buildings. Former foreign trade advisor for the French government. International MBA at EM Lyon + HEC Montreal, Masters in Marketing and Sales at Cnam School, Advanced Studies in Electronics at ECE Paris, Senior Leadership Proram at IMD Lausanne, Artificial Intelligence Certificate at MIT, Operational Excellence Certificate at ESSEC, and Corporate Finance Certificate at HEC Paris.      Dr. Seth Sanders Co-Founder and Chief Scientist
 	      Leading expert in electrical energy and power conversion systems, with extensive experience in flywheel energy storage systems, electric machine design, renewable energy systems, high frequency integrated power conversion circuits, and IC designs for power conversion applications. Received S.B. degrees in Electrical Engineering and Physics, S.M. and Ph.D. degrees in Electrical Engineering from the Massachusetts Institute of Technology, Cambridge. Joined the UC Berkeley faculty as Professor in the EECS Department and is presently an emeritus faculty member since retiring in 2021. Served as Chair of the IEEE PELS Technical Committee on Computers in Power Electronics and as Chair of the IEEE PELS Technical Committee on Power Conversion Components and Systems. He is an IEEE Fellow, has served as a Distinguished Lecturer of the IEEE PELS and IAS societies, and is a recipient of the IEEE PELS Modeling and Control Technical Achievement Award.      Edgard Magpantay Global VP of Supply Chain
 	      Over 20 years of experience in supply chain, category management, contracting and procurement, with several roles in Shell Philippines in supply chain and procurement functions. Previous President of the Philippine Institute for Supply Mgmt (PISM) and member of the Society of Fellows in Supply Mgmt (SOFSM). MBA from University of the Philippines; BS in Commerce, Business Management from De La Salle University.      Roger Hitchcock Global VP of Engineering
 	      40 years of experience in Electrical Engineering with focus on design development and validation, successfully bringing products from inception to commercialization; prior to Amber Kinetics, directed a team with Artificial Muscle investigating electroactive polymer technology. Inventor/co-inventor of 14 US patents (several related to electroactive polymer technology); author or co-author of over 20 publications. B.S and M.S. in Electrical Engineering from State University of New York.      Michael Hayward Director, Amber Kinetics Australia
 	      40+ years experience in manufacturing and logistics, with 15+ years of experience in the renewables sector and comprehensive knowledge of Australia’s renewable energy and electricity markets. Operated his own renewable energy company for seven years over two states of Australia, developing a strong network of residential and small to medium Commercial & Industrial customers. Previously at SMR Automotive, Hills Limited, Jarrett Industries and Monroe Australia. Graduate Certificate in Business Management from the University of South Australia and graduated from Scotch College (South Australia).      Merrill Sutherland GM, Global Human Resources
 	      Previously a founder of a chemical delivery company, SilPac; over 30 years of experience in developing and growing organizations including Millipore Sigma. Held roles in Operations Management, Human Resources, Product Management and Business Development. BS in Business Administration – Production Operations Management and Economics from Colorado State University.                              Do you think you have what it takes to join the Amber Kinetics Team?               We are always on the look out for the best talent to help in all areas of our operation. Whether you're a mechanical engineer, know your way around a circuit board or a dab hand a getting those around you organised we'd love to hear from those who share our passions for sustainability and word class product quality.                             View our vacancies here.                            Find out more.  Get in touch!               •    •        32920 Alvarado Niles Road #250, Union City, California 94587 +1.510.474.1000                                ©                             2024				    		Amber Kinetics, Inc. All rights reserved.                          Legal & Cookie Policy | Data Room | Target Market Application",https://amberkinetics.com/leadership/
amberkinetics,"Join Our Team | Amber Kinetics, Inc","Join Our Team | Amber Kinetics, Inc                                                  Skip to the content         Search              Menu       Technology Company  Team Careers   Installations News Contact        Search             			Search for:		       					Close search				              Close Menu     Technology CompanyShow sub menu  Team Careers   Installations News Contact             Join Our Team            
 
 	At Amber Kinetics, our people are the core of our culture of constant innovation. We are a global company with offices spanning three continents, but our values remain the same—we value; inclusion, diversity, collaboration, sustainability, creativity, flexibility, tenacity, individual responsibility, different creative points of view and welcome unique perspectives.
 
 	Our team is made up of motivated, passionate individuals that appreciate our open, honest, and transparent work style. We all feel we are part of something special as we work towards the common goal of transforming the global energy landscape. 
 
 	 
 		No matter which office you call home, we offer the following:
 
 		 Competitive compensation and equity packages (commensurate with experience). Healthy work-life balance. We are an Equal Opportunity Employer. Flexible work arrangements. Progressive time-off of work policies.      
 		Powered by          Find out more.  Get in touch!               •    •        32920 Alvarado Niles Road #250, Union City, California 94587 +1.510.474.1000                                ©                             2024				    		Amber Kinetics, Inc. All rights reserved.                          Legal & Cookie Policy | Data Room | Target Market Application",https://amberkinetics.com/careers/
amberkinetics,"Installation Portfolio | Amber Kinetics, Inc","Installation Portfolio | Amber Kinetics, Inc                                                  Skip to the content         Search              Menu       Technology Company  Team Careers   Installations News Contact        Search             			Search for:		       					Close search				              Close Menu     Technology CompanyShow sub menu  Team Careers   Installations News Contact           Amber Kinetics' fleet of installations has accumulated over               1401158         hours         of run time around the world       Installation Portfolio           Amber Kinetics is trusted by the world’s most advanced & innovative companies and utilities. With over 1,000,000 hours of run time, Amber Kinetics flywheels are setting the standard for safe and reliable long-duration energy storage.         The Reliable Energy Solution  
 				Orlando Utilities Commission / Florida, USA
 			         Developing Solutions through Shared Expertise  
 				P2C Engineering / Victoria, Australia
 			         Innovation and Technology towards Carbon Neutrality  
 				Itochu Enex / Tokyo, Japan
 			         Advancing a Sustainable Future through Energy Storage  
 				Meralco / Manila, Philippines
 			         The World’s Only Flywheel Innovation Hub  
 				De La Salle University (DLSU) / Laguna, Philippines
 			         Utility of the Future  
 				West Boylston Municipal Light and Power / Massachusetts, USA
 			         Providing Impeccable Performance & Flexibility  
 				Enel / California, USA
 			         Taiwan’s First Long Duration Energy Flywheel  
 				Taiwan Power Research Institute / Taipei, Taiwan
 			         Only Ruggedized  Energy Storage Solution  
 				Yungao Renewables / Lhasa, Tibet
 			         Solving Island Grid Challenges  
 				Hawaiian Electric Company (HECO) / Hawaii, USA
 			           Find out more.  Get in touch!               •    •        32920 Alvarado Niles Road #250, Union City, California 94587 +1.510.474.1000                                ©                             2024				    		Amber Kinetics, Inc. All rights reserved.                          Legal & Cookie Policy | Data Room | Target Market Application",https://amberkinetics.com/installations/
amberkinetics,"Get in touch | Amber Kinetics, Inc","Get in touch | Amber Kinetics, Inc                                                  Skip to the content         Search              Menu       Technology Company  Team Careers   Installations News Contact        Search             			Search for:		       					Close search				              Close Menu     Technology CompanyShow sub menu  Team Careers   Installations News Contact             Get in touch                         First Name        Last Name        Email Address*         Subject*        Company        Phone Number        Message*            *Required field. 		   All information collected is done so in accordance with our strict privacy policy. You can change your mind and opt out of receiving any email communication at any time. If you no longer wish to receive marketing emails from us please let us know using the above contact form or click ‘unsubscribe’ from any of our marketing emails. 		            Our Offices       USA & Head Office                  32920 Alvarado Niles Rd #250                 Union City                 CA 94587  phone +1 (510)-474-1000         Philippines Office                  First Philec Inc.                 1st Street                 First Philippine Industrial Park                 Sto. Tomas                 Batangas 4234                    Australia Office                  15 McCabe Street                 North Fremantle                 WA 6159  phone +61 (0)434 682 694                  •    •        32920 Alvarado Niles Road #250, Union City, California 94587 +1.510.474.1000                                ©                             2024				    		Amber Kinetics, Inc. All rights reserved.                          Legal & Cookie Policy | Data Room | Target Market Application",https://amberkinetics.com/contact/
